200071520,CC Domfront Tinchebray Interco,"9,7","19,9","70,4",100
240500462,CC du Pays des Ecrins,"9,7","19,7","70,7",100
246900765,CC du Pays de l'Ozon,"9,7","17,7","72,6",100
248300493,CA Dracénie Provence Verdon Agglomération,"9,7","28,2","62,1",100
200005932,CC des Portes de Sologne,"9,6","15,5","74,9",100
200042604,"CC de Granville, Terre et Mer","9,6","25,5","64,9",100
200069003,CC du Barséquanais en Champagne,"9,6",17,"73,4",100
241800432,CC Les Trois Provinces,"9,6","18,9","71,5",100
245400189,CC des Pays du Sel et du Vermois,"9,6","20,2","70,1",100
246701064,CC de la Région de Molsheim-Mutzig,"9,6","23,3","67,2",100
200039204,CC de Lacq-Orthez,"9,5","18,6","71,9",100
200067247,CC Pleyben-Châteaulin-Porzay,"9,5","16,3","74,2",100
241200567,CC de Millau Grands Causses,"9,5","27,8","62,8",100
247400740,CC Rumilly Terre de Savoie,"9,5","18,7","71,7",100
200039022,CA Vitré Communauté,"9,4","21,2","69,4",100
243600319,CC Brenne-Val de Creuse,"9,4","19,2","71,3",100
245100979,CC du Sud Marnais,"9,4","21,3","69,3",100
247400567,CC Fier et Usses,"9,4","18,7","71,9",100
200043263,CC Cœur de l'Avesnois,"9,3","27,2","63,5",100
200066801,CC Isigny-Omaha Intercom,"9,3","15,8","74,9",100
200067031,CC Côte Ouest Centre Manche,"9,3","18,9","71,8",100
245100888,CC de la Brie Champenoise,"9,3","20,8",70,100
246600449,CC des Aspres,"9,3","21,1","69,6",100
200034882,CC Pays du Mont-Blanc,"9,2","26,9","63,9",100
200040491,CC Porte de Drômardèche,"9,2","22,2","68,6",100
200070316,"CC Entre Arroux, Loire et Somme","9,2","17,5","73,3",100
200070902,CC Auxonne Pontailler Val de Saône,"9,2",17,"73,8",100
200071934,CC Pays de Fontenay-Vendée,"9,2","20,3","70,4",100
241400860,CC Cœur de Nacre,"9,2","22,3","68,6",100
244301131,CC Loire et Semène,"9,2","17,9","72,9",100
200036473,CA de Saintes,"9,1",25,"65,9",100
200039857,CA du Pays de Grasse,"9,1","26,2","64,7",100
200044030,CC des 7 Vallées,"9,1","21,4","69,5",100
200067064,CC Decazeville Communauté,"9,1","21,3","69,7",100
200067676,CC Canaux et Forêts en Gâtinais,"9,1","16,5","74,3",100
200069912,CC des Forêts du Perche,"9,1","15,2","75,7",100
200070092,CA du Libournais,"9,1","28,3","62,6",100
246200844,CC de la Région d'Audruicq,"9,1","18,3","72,6",100
200069847,CC Plateau de Caux-Doudeville-Yerville,9,"16,7","74,4",100
200070340,CC Haute Maurienne Vanoise,9,22,69,100
200071777,"CC d'Arcis, Mailly, Ramerupt",9,"21,1","69,9",100
243600293,CC de la Région de Levroux,9,"13,4","77,6",100
245501184,CC du Pays de Revigny-sur-Ornain,9,18,73,100
247300452,CC Maurienne Galibier,9,"20,2","70,8",100
200034700,CA Durance-Lubéron-Verdon Agglomération,"8,9","29,9","61,2",100
200060010,CA Mauges Communauté,"8,9","15,8","75,3",100
200069425,CA Mont-Saint-Michel-Normandie,"8,9","23,6","67,4",100
200070647,CA Bergeracoise,"8,9","25,6","65,5",100
241000447,CC du Pays d'Othe,"8,9","11,8","79,3",100
248400053,CA Ventoux-Comtat-Venaissin (COVE),"8,9","32,6","58,5",100
249710047,CC de Marie-Galante,"8,9","20,3","70,9",100
200029999,CC Rives de l'Ain-Pays du Cerdon,"8,8",20,"71,2",100
200035319,CA Estérel Côte d'Azur Agglomération,"8,8","28,7","62,5",100
200040244,CA du Bocage Bressuirais,"8,8","18,7","72,5",100
200067874,CA de Haguenau,"8,8","26,5","64,6",100
200071587,CC Loches Sud Touraine,"8,8","18,3","72,9",100
200072346,CA du Pays de Fontainebleau,"8,8","24,6","66,6",100
200072668,CC Touraine Val de Vienne,"8,8","16,6","74,5",100
243801073,CC de Bièvre Est,"8,8","13,4","77,8",100
247200686,CC du Pays de l'Huisne Sarthoise,"8,8","21,5","69,7",100
247700032,CC Moret Seine et Loing,"8,8","15,8","75,4",100
200040954,CC des Hauts de Flandre,"8,7","17,7","73,6",100
200042620,CC de la Région de Suippes,"8,7",25,"66,3",100
200068534,CC Terroir de Caux,"8,7","15,7","75,6",100
200070712,CC Thiers Dore et Montagne,"8,7","20,2","71,1",100
200072650,CC Touraine Vallée de l'Indre,"8,7","13,8","77,6",100
241700459,CC de l'Île de Ré,"8,7","22,4","68,9",100
242900744,CC Poher communauté,"8,7","18,6","72,6",100
200066835,CC de Sézanne-Sud Ouest Marnais,"8,6",17,"74,3",100
241200187,CA Rodez Agglomération,"8,6","34,4","56,9",100
243301371,CC du Pays Foyen,"8,6","29,8","61,6",100
245700133,CC du District Urbain de Faulquemont (DUF),"8,6","19,3","72,1",100
247300262,CC de Yenne,"8,6","17,4",74,100
247700065,CC du Pays de l'Ourcq,"8,6","21,6","69,9",100
200035087,CA Terre de Provence,"8,5","30,4","61,1",100
200040558,CC Écueillé-Valençay,"8,5","15,4","76,1",100
200043172,CA du Bassin de Brive,"8,5","26,3","65,3",100
200043321,CC du Pays de Mormal,"8,5","19,3","72,2",100
200055481,CC Beauce Val de Loire,"8,5","15,4","76,1",100
200069060,CC des Vosges du Sud,"8,5","16,2","75,3",100
200070118,CC Val de Saône Centre,"8,5","16,4","75,2",100
200071850,CC du Pithiverais-Gâtinais,"8,5","15,5",76,100
241000223,"CC Forêts, Lacs, Terres en Champagne","8,5","13,5",78,100
241400878,CC Terre d'Auge,"8,5","18,4","73,2",100
242900835,CA Morlaix Communauté,"8,5","18,9","72,6",100
244000691,CC du Pays Morcenais,"8,5","19,6","71,9",100
245500327,CC du Sammiellois,"8,5","22,8","68,7",100
200035764,CC de la Beauce Loirétaine,"8,4",17,"74,6",100
200040764,CC du Sud Corse,"8,4","35,1","56,4",100
200066744,CC Haute-Corrèze Communauté,"8,4","21,1","70,5",100
200069664,CC Meuse Rognon,"8,4","14,1","77,5",100
200073245,CC du Bassin d'Aubenas,"8,4","28,1","63,5",100
200090504,CA Coulommiers Pays de Brie,"8,4","21,2","70,4",100
200041721,CC de la Haute Comté,"8,3","18,2","73,5",100
200070944,CC du Vimeu,"8,3","21,5","70,1",100
243500550,CC Montfort Communauté,"8,3","16,1","75,6",100
243500774,CC Liffré-Cormier Communauté,"8,3","18,4","73,3",100
247000706,CC du Pays Riolais,"8,3","19,4","72,4",100
247900798,CC du Thouarsais,"8,3","19,2","72,6",100
200040111,CC Cœur de Chartreuse,"8,2","16,3","75,4",100
200040624,CC Pays d'Apt-Luberon,"8,2","27,3","64,5",100
200070142,CC Lyons Andelle,"8,2","18,3","73,5",100
200070365,CC Corbières Salanque Méditerranée,"8,2","20,9","70,9",100
200070845,CC Orne Lorraine Confluences,"8,2","23,9","67,9",100
242101442,CC de Saulieu,"8,2","21,7","70,2",100
243301264,CC de Montesquieu,"8,2","18,4","73,4",100
247600729,CC Falaises du Talou,"8,2","16,3","75,5",100
200000925,CC de la Plaine Dijonnaise,"8,1","10,3","81,6",100
200069722,CC Interrégionale Aumale-Blangy-sur-Bresle,"8,1","20,5","71,3",100
200070670,CC du Pays de Dol et de la Baie du Mont Saint-Michel,"8,1","18,6","73,3",100
200070746,CA Sarreguemines Confluences,"8,1",27,65,100
200071553,CC Loire Layon Aubance,"8,1","15,7","76,2",100
200072676,CC Maine Saosnois,"8,1","20,2","71,6",100
245900758,CC Flandre Lys,"8,1","20,9",71,100
200067700,CC Sud Nivernais,8,"20,4","71,6",100
200069698,CC Mâconnais-Tournugeois,8,"21,7","70,3",100
200070753,CA Riom Limagne et Volcans,8,"20,1","71,9",100
200072478,CC Pays d'Opale,8,"19,2","72,8",100
242100154,CC des Vallées de la Tille et de l'Ignon,8,15,77,100
246700967,CC de Sélestat,8,"31,5","60,5",100
247300361,CC du Canton de La Chambre,8,17,75,100
248500662,CC du Pays de Mortagne,8,"14,4","77,6",100
200033173,CC de la Haute Vallée de Chevreuse,"7,9",17,"75,1",100
200035855,CC Castelnaudary Lauragais Audois,"7,9","30,1",62,100
200065886,CA Loire Forez Agglomération,"7,9","19,8","72,3",100
242101434,CC du Pays Châtillonnais,"7,9","18,4","73,7",100
242900801,CA du Pays de Landerneau-Daoulas,"7,9","15,1",77,100
246000897,CC de la Plaine d'Estrées,"7,9","18,4","73,8",100
246900724,CC des Vallons du Lyonnais (CCVL),"7,9","20,9","71,2",100
200030633,CA du Caudrésis et du Catésis,"7,8","26,7","65,5",100
200067155,"CC Saint Affricain, Roquefort, Sept Vallons","7,8",23,"69,3",100
200068435,CC Cœur du Perche,"7,8","14,8","77,4",100
200070373,CC Loir-Lucé-Bercé,"7,8","19,1","73,1",100
200070928,CC Terre de Picardie,"7,8","21,4","70,8",100
200017341,CC Lodévois et Larzac,"7,7","31,2","61,1",100
200027100,CC Méditerranée Porte des Maures,"7,7","27,6","64,7",100
200043602,"CC des Albères, de la Côte Vermeille et de l'Illibéris","7,7","27,1","65,2",100
200066587,CC des Monts du Lyonnais,"7,7","18,5","73,8",100
200067304,CC Serein et Armance,"7,7","17,9","74,4",100
200068765,CC du Sisteronais-Buëch,"7,7","28,7","63,5",100
200070431,CC Saint-Marcellin Vercors Isère Communauté,"7,7","20,2","72,1",100
240600551,CA de la Riviera Française,"7,7","34,7","57,5",100
241500271,CC du Pays de Mauriac,"7,7","21,1","71,2",100
243400355,CC du Clermontais,"7,7","27,8","64,5",100
246000749,CC des Lisières de l'Oise,"7,7","14,8","77,5",100
247400112,CC du Pays de Cruseilles,"7,7","21,3",71,100
248300410,CC de la Vallée du Gapeau,"7,7","25,1","67,3",100
200066322,CC Terres des Confluences,"7,6","25,8","66,5",100
200068989,CA Dinan Agglomération,"7,6","18,8","73,6",100
200070514,CA du Grand Cognac,"7,6","23,6","68,9",100
200071041,CC du Chaourçois et du Val d'Armance,"7,6","13,4",79,100
200071579,CC Bresse Louhannaise Intercom',"7,6","19,7","72,7",100
200072692,CC des Vallées de la Braye et de l'Anille,"7,6","18,7","73,6",100
200073419,CA du Puy-en-Velay,"7,6","25,8","66,6",100
240600585,CA de Sophia Antipolis,"7,6","31,6","60,8",100
244301099,CC Auzon Communauté,"7,6","17,5","74,9",100
248500340,CC Pays de Chantonnay,"7,6","17,1","75,4",100
248500621,CC du Pays des Herbiers,"7,6","21,8","70,6",100
200036077,CC du Golfe de Saint-Tropez,"7,5","32,4","60,1",100
200059392,CC Bièvre Isère,"7,5",19,"73,5",100
200066231,CC des Portes d'Ariège Pyrénées,"7,5","32,1","60,4",100
200067767,CC du Royans-Vercors,"7,5","22,6","69,8",100
200067981,CA Guingamp-Paimpol Agglomération de l'Armor à l'Argoat,"7,5","20,2","72,3",100
200070811,CC Pyrénées Vallées des Gaves,"7,5","21,4","71,1",100
200085728,CC Brioude Sud Auvergne,"7,5","24,2","68,3",100
244400552,CC du Pays d'Ancenis,"7,5","17,8","74,7",100
244500427,CC des Loges,"7,5","17,4","75,1",100
200023919,CC Gâtinais Val de Loing,"7,4","17,9","74,6",100
200027217,CC Sarlat-Périgord Noir,"7,4",27,"65,5",100
200035442,CC du Sud-Artois,"7,4",18,"74,6",100
200042463,CC de la Montagne Noire,"7,4","20,3","72,4",100
200058360,CC Entre Beauce et Perche,"7,4","15,4","77,2",100
243200417,CC de la Tenarèze,"7,4",23,"69,6",100
243800745,CC de l'Oisans,"7,4",25,"67,6",100
200065928,CA Lannion-Trégor Communauté,"7,3","19,2","73,5",100
200067445,CC Buëch-Dévoluy,"7,3","21,2","71,5",100
200067668,"CC de la Cléry, du Betz et de l'Ouanne","7,3","15,5","77,2",100
200069672,CC du Ternois,"7,3","24,2","68,5",100
200070894,CC de Gevrey-Chambertin et de Nuits-Saint-Georges,"7,3","16,2","76,6",100
200071371,CC Bresse et Saône,"7,3","19,8","72,9",100
200071942,CC Haut Limousin en Marche,"7,3","14,6","78,1",100
200072064,CC Val-de-Cher-Controis,"7,3","17,3","75,3",100
200072080,CC du Pays de Saint-Éloy,"7,3","16,1","76,6",100
200072726,CC Châteaubriant-Derval,"7,3","19,7",73,100
240200469,CC du Pays de la Serre,"7,3","19,3","73,3",100
240700617,CC Val de Ligne,"7,3","21,9","70,8",100
243100773,CC Val'Aïgo,"7,3","21,2","71,5",100
200040574,CC Beaujolais Pierres Dorées,"7,2","17,5","75,2",100
200067916,CC Cœur de Loire,"7,2","19,3","73,5",100
200070159,CC Cœur de Beauce,"7,2","14,2","78,6",100
200070183,CC des Terres du Val de Loire,"7,2","17,1","75,8",100
200071223,CC Nièvre et Somme,"7,2","19,5","73,3",100
240800920,CC de l'Argonne Ardennaise,"7,2",20,"72,9",100
244100293,CC des Collines du Perche,"7,2","17,9","74,9",100
244301016,CC des Sucs,"7,2","23,1","69,7",100
244400610,CA de la Presqu'île de Guérande Atlantique (Cap Atlantique),"7,2","19,2","73,6",100
247400583,CC Arve et Salève,"7,2","23,6","69,2",100
200018083,CC de Desvres-Samer,"7,1","21,2","71,7",100
200035848,CC du Châtillonnais en Berry,"7,1","16,4","76,5",100
200040095,CC Isle Vern Salembre en Périgord,"7,1","17,9",75,100
200043123,CC Auray Quiberon Terre Atlantique,"7,1","21,3","71,6",100
200055887,CC Mayenne Communauté,"7,1","25,1","67,9",100
200066025,CC Pays Rhin-Brisach,"7,1","17,8",75,100
200066363,CC de la Haute Ariège,"7,1","22,5","70,5",100
200071769,CC Picardie des Châteaux,"7,1","18,2","74,6",100
241927201,CA Tulle Agglo,"7,1","20,9",72,100
243500667,CC Val d'Ille-Aubigné,"7,1","17,5","75,4",100
243900354,CC de la Station des Rousses-Haut Jura,"7,1","26,8","66,1",100
246600464,CC Pyrénées catalanes,"7,1",34,"58,9",100
246800205,CC de la Vallée de Saint-Amarin,"7,1","15,3","77,6",100
248000499,CC du Val de Somme,"7,1","17,4","75,4",100
200033298,CC des Coëvrons,7,"19,2","73,7",100
200065894,CC de Forez-Est,7,"21,1","71,9",100
200068088,CC Les Bertranges,7,"17,5","75,5",100
200072544,CC des Deux Morin,7,"17,9","75,1",100
243301504,CA du Bassin d'Arcachon Nord,7,"22,1","70,9",100
244400453,CC de la Région de Blain,7,"19,5","73,4",100
244500484,CC de la Forêt,7,"12,6","80,4",100
200070688,CC Couesnon Marches de Bretagne,"6,9","19,1",74,100
240200493,CC du Pays du Vermandois,"6,9",22,"71,1",100
242852465,CC du Bonnevalais,"6,9","15,9","77,2",100
243301405,CC du Val de l'Eyre,"6,9","17,1","75,9",100
246600373,CC du Vallespir,"6,9","28,6","64,5",100
200040293,CC du Clunisois,"6,8","21,8","71,3",100
200041994,CC Haut Val de Sèvre,"6,8",20,"73,2",100
200073013,CC Carnelle Pays-de-France,"6,8","15,8","77,4",100
200096634,CC des Hautes Vosges,"6,8","20,2",73,100
240700864,CC du Rhône aux Gorges de l'Ardèche,"6,8","24,3","68,9",100
243000650,CC Terre de Camargue,"6,8",31,"62,2",100
243500659,CC Pays de Châteaugiron Communauté,"6,8","19,4","73,9",100
247103765,CC Entre Saône et Grosne,"6,8","17,3","75,8",100
248500464,CC du Pays de Pouzauges,"6,8","16,2",77,100
200007177,CC Pays de Nérondes,"6,7","17,3","75,9",100
200042000,CC Bruyères-Vallons des Vosges,"6,7","22,8","70,5",100
200071918,CC du Pays de Saint-Fulgent-Les Essarts,"6,7","16,1","77,3",100
200072734,CC Estuaire et Sillon,"6,7","15,1","78,2",100
242010130,CC du Sartenais Valinco Taravo,"6,7","33,8","59,6",100
200035202,CC Charlieu-Belmont,"6,6","21,4",72,100
200041150,CC Terrassonnais Haut Périgord Noir,"6,6","21,6","71,8",100
200043974,CC du Sud Gironde,"6,6","29,2","64,3",100
200070407,CA Agglo Pays d'Issoire,"6,6","21,3","72,2",100
200071314,CC des Hauts Tolosans,"6,6","22,7","70,7",100
200072882,CC de Vie et Boulogne,"6,6","16,3","77,1",100
242600252,CC du Val de Drôme en Biovallée,"6,6","20,7","72,7",100
243400819,CA Hérault-Méditerranée,"6,6","30,9","62,5",100
244800470,CC du Gévaudan,"6,6","24,7","68,7",100
245501242,CC du Pays d'Étain,"6,6","24,6","68,9",100
246600399,CC Pyrénées Cerdagne,"6,6",33,"60,4",100
246800577,CC du Pays de Ribeauvillé,"6,6","26,8","66,5",100
200023620,CC de la Gascogne Toulousaine,"6,5",21,"72,5",100
200035129,CC de Cèze Cévennes,"6,5","28,5","64,9",100
200071165,CA Les Sables d'Olonne Agglomération,"6,5",24,"69,5",100
242900710,CC du Haut Pays Bigouden,"6,5","10,8","82,7",100
247200447,CC Orée de Bercé-Belinois,"6,5","15,6",78,100
200066603,CC du Pays de Lubersac-Pompadour,"6,4","16,8","76,7",100
200070951,CC du Territoire Nord Picardie,"6,4","19,7","73,9",100
200072304,CC Vallée de l'Ubaye-Serre-Ponçon,"6,4","27,6",66,100
200073252,CC de la Castagniccia-Casinca,"6,4","30,8","62,9",100
240700815,CC Berg et Coiron,"6,4","22,9","70,7",100
243500733,CC Bretagne Romantique,"6,4","18,9","74,7",100
245300223,CC du Pays de Meslay-Grez,"6,4","19,6",74,100
245614433,CC Pontivy Communauté,"6,4","20,4","73,2",100
245701354,CC de l'Arc Mosellan,"6,4","13,4","80,1",100
246700926,CC du Pays de Wissembourg,"6,4","26,1","67,5",100
248500415,CC du Pays de la Châtaigneraie,"6,4","15,7","77,9",100
200006930,CC du Haut Allier,"6,3","25,1","68,6",100
200066512,CC Élan Limousin Avenir Nature,"6,3","12,8","80,9",100
200066728,CC Vallées de l'Orne et de l'Odon,"6,3","12,5","81,2",100
200067379,CC Côtes de Champagne et Val de Saulx,"6,3","16,2","77,4",100
200069227,CC Pays Fort Sancerrois Val de Loire,"6,3","15,9","77,8",100
200071470,CC Entr'Allier Besbre et Loire,"6,3","21,5","72,2",100
200073096,CA Arche Agglo,"6,3","24,6","69,2",100
240200576,CC de la Champagne Picarde,"6,3","18,4","75,3",100
240900431,CC du Pays de Tarascon,"6,3","22,3","71,4",100
242900694,CA Quimperlé Communauté,"6,3","16,1","77,7",100
245400171,CC Moselle et Madon,"6,3","16,6","77,1",100
245600465,CC de Belle-Île-en-Mer,"6,3","21,2","72,5",100
246800585,CC de la Vallée de Munster,"6,3","22,8","70,9",100
248000747,CC du Pays du Coquelicot,"6,3","22,5","71,2",100
200016905,CC du Pays de Lamastre,"6,2","21,4","72,5",100
200048551,CC du Pays de Craon,"6,2","19,5","74,3",100
200066165,CC Val de Meuse-Voie Sacrée,"6,2","17,2","76,5",100
200066710,CC Cingal-Suisse Normande,"6,2","15,5","78,3",100
200067866,CC Sèvre et Loire,"6,2","17,4","76,4",100
200069185,CC des Terres d'Apcher-Margeride-Aubrac,"6,2","22,8","71,1",100
200071496,CC du Bocage Bourbonnais,"6,2","20,5","73,3",100
243700820,CC de Bléré Val de Cher,"6,2",15,"78,8",100
244100798,CC du Grand Chambord,"6,2",15,"78,8",100
244200895,CC du Pilat Rhodanien,"6,2","19,2","74,6",100
246900575,CC de l'Est Lyonnais (CCEL),"6,2",17,"76,8",100
200042182,CC du Mont des Avaloirs,"6,1","18,1","75,8",100
200066868,CC Presqu'île de Crozon-Aulne maritime,"6,1",16,"77,8",100
200070548,CC Brionnais Sud Bourgogne,"6,1","18,2","75,7",100
200071595,"CC Arbois, Poligny, Salins, Cœur du Jura","6,1","24,2","69,6",100
242900561,CC de Haute Cornouaille,"6,1","13,2","80,7",100
243301223,CC du Grand Cubzaguais,"6,1","26,1","67,8",100
245501259,CC du Pays de Montmédy,"6,1","21,6","72,3",100
247200629,CC du Val de Sarthe,"6,1","13,6","80,3",100
200043628,CC des Vallées du Clain,6,"15,9","78,1",100
200066116,CC Argonne-Meuse,6,"16,3","77,6",100
200066652,CC Grand Sud Tarn et Garonne,6,"21,4","72,6",100
200067544,CC Creuse Confluence,6,"17,1","76,9",100
200069151,CC Gorges Causses Cévennes,6,"26,3","67,7",100
200069656,CC Cœur Haute Lande,6,"22,6","71,4",100
200070852,CC Usses et Rhône,6,"18,7","75,3",100
200071033,CC Jabron-Lure-Vançon-Durance,6,"22,4","71,6",100
200073112,CC Sud Sarthe,6,17,77,100
242900702,CC du Pays Bigouden Sud,6,"14,3","79,7",100
244200622,CC des Monts du Pilat,6,"19,9",74,100
247000821,CC Rahin et Chérimont,6,15,"79,1",100
247200421,CC du Sud Est Manceau,6,"13,9","80,1",100
200041507,CA La Riviera du Levant,"5,9","26,3","67,8",100
200044048,CC Osartis Marquion,"5,9","15,2","78,9",100
200066884,CC Quercy Vert-Aveyron,"5,9","20,2",74,100
200067924,CC du Canton d'Erstein,"5,9","22,2","71,9",100
240200634,CC des Portes de la Thiérache,"5,9",23,"71,1",100
242504447,CC du Doubs Baumois,"5,9","19,4","74,7",100
242900629,CC Cap Sizun-Pointe du Raz,"5,9","9,1",85,100
244000865,CC Maremne Adour Côte Sud,"5,9","26,2","67,9",100
245300355,CC de l'Ernée,"5,9","20,6","73,5",100
200034957,CC du Frontonnais,"5,8","21,7","72,5",100
200041366,CC Rhône Crussol,"5,8",22,"72,2",100
200041879,CC Terres de Saône,"5,8",19,"75,3",100
200066405,CC Roumois Seine,"5,8","14,4","79,8",100
200066660,CC Saint-Flour Communauté,"5,8","20,5","73,7",100
200070043,CC Vienne et Gartempe,"5,8","18,1","76,1",100
200070332,CC des Savoir-Faire,"5,8","13,7","80,5",100
200073237,CC de Gâtine et Choisilles-Pays de Racan,"5,8","14,5","79,7",100
241927243,CC du Pays d'Uzerche,"5,8","16,5","77,7",100
243500618,CC Brocéliande Communauté,"5,8","17,5","76,7",100
243801024,CC du Massif du Vercors,"5,8","23,3","70,9",100
245600440,CC de Blavet Bellevue Océan,"5,8","14,1","80,2",100
248200057,CC du Quercy Caussadais,"5,8","28,1","66,1",100
200005957,CC de la Région de Rambervillers,"5,7","25,5","68,8",100
200030674,CA Val de Garonne Agglomération,"5,7","28,7","65,6",100
200036499,CC de Marana-Golo,"5,7","30,1","64,2",100
200067072,CC Haut-Léon Communauté,"5,7","18,2",76,100
200069755,CC Mellois en Poitou,"5,7","18,7","75,6",100
242101509,CC Rives de Saône,"5,7","15,6","78,7",100
243000270,CC du Pays Viganais,"5,7","28,3","66,1",100
243200508,CC Bastides et Vallons du Gers,"5,7","19,4","74,9",100
243301215,CC du Créonnais,"5,7",20,"74,2",100
243900610,CC La Grandvallière,"5,7","19,5","74,8",100
244400503,CC d'Erdre et Gesvres,"5,7","14,5","79,8",100
246201016,CC du Pays de Lumbres,"5,7","18,3",76,100
247100639,CC de Marcigny,"5,7","20,4","73,9",100
247600604,CC de Londinières,"5,7","19,5","74,8",100
248719288,CC du Val de Vienne,"5,7","13,3",81,100
200030435,CC d'Aire-sur-l'Adour,"5,6","25,6","68,7",100
200041465,CC Val Eyrieux,"5,6","18,5","75,9",100
200068443,CC Andaine-Passais,"5,6","22,9","71,5",100
200068542,CC Les Balcons du Dauphiné,"5,6","17,5","76,9",100
200068773,CC des Vosges côté Sud Ouest,"5,6","15,6","78,8",100
200072056,CC Porte du Jura,"5,6","20,2","74,1",100
200072684,CC Le Gesnois Bilurien,"5,6","16,2","78,2",100
200073260,CC Sud Vendée Littoral,"5,6","18,6","75,8",100
240300566,CC du Val de Cher,"5,6","11,9","82,5",100
240400440,CC Pays Forcalquier et Montagne de Lure,"5,6",31,"63,3",100
243000569,"CC Rhony, Vistre, Vidourle","5,6","23,8","70,6",100
243600343,CC Cœur de Brenne,"5,6","15,5","78,9",100
248300394,CA Sud Sainte Baume,"5,6","29,2","65,2",100
200068229,CC des Baronnies en Drôme Provençale,"5,5","31,3","63,2",100
200073427,CC Marches du Velay-Rochebaron,"5,5","19,2","75,3",100
244000873,CC des Grands Lacs,"5,5","24,3","70,2",100
246600282,CC Sud-Roussillon,"5,5","26,6",68,100
246900740,CC du Pays Mornantais (COPAMO),"5,5","19,1","75,3",100
247000623,CC des Quatre Rivières,"5,5","20,3","74,2",100
200011781,CC Portes du Berry entre Loire et Val d'Aubois,"5,4","15,6",79,100
200018521,CC du Val de Bouzanne,"5,4",13,"81,6",100
200038990,CC de Saint-Méen Montauban,"5,4","21,5","73,1",100
200067189,CC Creuse Sud Ouest,"5,4","15,7",79,100
200070449,CC Inter-Caux-Vexin,"5,4","13,1","81,5",100
240200501,CC du Val de l'Aisne,"5,4","17,7","76,9",100
241501089,CC Cère et Goul en Carladès,"5,4","17,7",77,100
241700624,CC de l'Île d'Oléron,"5,4",24,"70,5",100
242600534,CC du Diois,"5,4","29,9","64,7",100
242900751,CC du Pays de Landivisiau,"5,4","18,6",76,100
244100780,CC de la Sologne des Étangs,"5,4","18,7","75,9",100
246000707,CC du Vexin-Thelle,"5,4","14,2","80,4",100
200041333,CC de Parthenay-Gâtine,"5,3","23,8","70,9",100
200043776,CC Pyrénées Audoises,"5,3","25,1","69,6",100
200070233,CA Terres de Montaigu,"5,3","18,8","75,9",100
200070787,CC du Plateau de Lannemezan,"5,3","20,1","74,7",100
240200584,CC du Canton de Charly-sur-Marne,"5,3","19,4","75,3",100
240300558,CC du Pays de Tronçais,"5,3","18,3","76,4",100
242504116,CC du Val de Morteau,"5,3","29,7",65,100
242900793,CC Communauté Lesneven Côte des Légendes,"5,3","15,7",79,100
243200391,CC de la Lomagne Gersoise,"5,3","24,6","70,1",100
243200425,CC Cœur d'Astarac en Gascogne,"5,3","28,2","66,5",100
243801255,CC des Collines du Nord Dauphiné,"5,3","16,2","78,4",100
246600415,CC Roussillon-Conflent,"5,3","25,7",69,100
200007052,CC de la Marche Berrichonne,"5,2","13,3","81,5",100
200023075,CC du Pays de Maîche,"5,2","20,9","73,9",100
200032514,CC Berry-Loire-Vauvise,"5,2",14,"80,8",100
200066017,CC Lieuvin Pays d'Auge,"5,2","18,2","76,6",100
200067130,CC de Puisaye-Forterre,"5,2","16,1","78,7",100
200067460,CC Loudéac Communauté-Bretagne Centre,"5,2","20,4","74,4",100
200068880,CC Champagne Boischauts,"5,2","14,3","80,5",100
200069235,CC du Haut Pays du Montreuillois,"5,2","22,9",72,100
200071926,CC du Limouxin,"5,2","28,2","66,6",100
200072643,CC Cœur et Coteaux du Comminges,"5,2","26,4","68,4",100
200072700,CC Haute Sarthe Alpes Mancelles,"5,2","18,6","76,2",100
248719361,CC de Noblat,"5,2","17,4","77,4",100
200023307,CA du Grand Villeneuvois,"5,1","30,1","64,8",100
200023794,CC de Blaye,"5,1","27,8","67,1",100
200040475,CC Loué-Brûlon-Noyen,"5,1","20,4","74,5",100
200049211,CC Conflent-Canigó,"5,1","28,1","66,8",100
200066645,CC Vézère-Monédières-Millesources,"5,1","13,5","81,4",100
200090579,CC Terre d'Émeraude Communauté,"5,1","19,6","75,3",100
241501055,CC Sumène-Artense,"5,1","17,9",77,100
242020071,CC du Centre Corse,"5,1","55,8","39,1",100
242700607,CC du Pays du Neubourg,"5,1","18,4","76,5",100
243000296,CC du Pays de Sommières,"5,1","26,4","68,4",100
243600202,CC Chabris-Pays de Bazelle,"5,1",19,"75,9",100
246600423,CC Agly Fenouillèdes,"5,1","21,2","73,7",100
246800551,CC de la Vallée de Kaysersberg,"5,1","23,1","71,8",100
247400617,CC des Vallées de Thônes,"5,1","28,3","66,6",100
200034023,CC Tarn-Agout,5,"26,8","68,2",100
200034098,CC des Montagnes du Giffre,5,"23,4","71,5",100
200034379,CC Pays d'Uzès,5,"26,6","68,4",100
200035137,CC Marche Occitane-Val d'Anglin,5,"14,6","80,4",100
200041416,CC Airvaudais-Val du Thouet,5,"18,1","76,9",100
200044394,CC du Réolais en Sud Gironde,5,"28,3","66,7",100
200066124,CA Gaillac-Graulhet,5,"23,9","71,1",100
200066819,CC du Volvestre,5,"23,1","71,9",100
200069763,CC du Haut-Poitou,5,"16,7","78,3",100
200069995,CC Médoc Cœur de Presqu'île,5,"27,3","67,7",100
200071173,CC du Pays Arnay Liernais,5,"14,5","80,5",100
200071645,CC Saint Cyr Mère Boitier entre Charolais et Mâconnais,5,"17,3","77,7",100
200096683,CC Centre Morbihan Communauté,5,"18,3","76,8",100
243500741,CA Redon Agglomération,5,"20,9","74,1",100
244400586,CC du Sud Estuaire,5,"21,2","73,8",100
247400047,CC de la Vallée Verte,5,"18,5","76,5",100
248300550,CC Cœur du Var,5,"27,9","67,1",100
200029734,CC des 4B Sud Charente,"4,9","22,4","72,7",100
200035863,"CC Région Lézignanaise, Corbières et Minervois","4,9","25,1","70,1",100
200039931,CC Alpes d'Azur,"4,9","24,8","70,3",100
200043982,CC du Bazadais,"4,9","27,7","67,4",100
200067239,CC des Luys en Béarn,"4,9","14,8","80,3",100
